{
  "$schema": "https://json-schema.org/draft/2020-12/schema",
  "$id": "https://igreja12.local/schemas/dev-connect-tls-auth-transport-probe-plan-v1.json",
  "title": "DEV CONNECT_TLS_AUTH offline transport probe plan",
  "type": "object",
  "additionalProperties": false,
  "required": [
    "$schema",
    "artifact_kind",
    "contract_version",
    "schema_binding",
    "execution_mode",
    "execution_disabled",
    "operational_authorization",
    "next_stage_authorized",
    "historical_result",
    "interpretation_boundary",
    "future_probe_contract",
    "mission_evidence",
    "next_gate"
  ],
  "properties": {
    "$schema": {
      "const": "./dev-connect-tls-auth-transport-probe-plan.schema.json"
    },
    "artifact_kind": {
      "const": "DEV_CONNECT_TLS_AUTH_TRANSPORT_PROBE_PLAN"
    },
    "contract_version": {
      "const": 1
    },
    "schema_binding": {
      "type": "object",
      "additionalProperties": false,
      "required": ["algorithm", "sha256"],
      "properties": {
        "algorithm": {"const": "SHA-256"},
        "sha256": {"type": "string", "pattern": "^[0-9a-f]{64}$"}
      }
    },
    "execution_mode": {
      "const": "OFFLINE_PLAN_ONLY"
    },
    "execution_disabled": {
      "const": true
    },
    "operational_authorization": {
      "const": false
    },
    "next_stage_authorized": {
      "const": false
    },
    "historical_result": {
      "type": "object",
      "additionalProperties": false,
      "required": [
        "environment",
        "repository_main_sha",
        "runner_sha256",
        "sql_sha256",
        "precise_timestamp_preserved",
        "exit_code",
        "sanitized_output"
      ],
      "properties": {
        "environment": {"const": "DEV"},
        "repository_main_sha": {"const": "bab031a7e0067a257eedb4a24c786cc925801463"},
        "runner_sha256": {"const": "8da631fbb602488bb8c82ce1529c9d8ba17acbae8a318ea9b0fc24cdd8f65cd2"},
        "sql_sha256": {"const": "001bfda9b4655d028abfb7d8f44ac6c4e5ab51861c9623dd54b1cdd0ab6ea336"},
        "precise_timestamp_preserved": {"const": false},
        "exit_code": {"const": 7},
        "sanitized_output": {
          "type": "object",
          "additionalProperties": false,
          "required": [
            "ENVIRONMENT",
            "OPERATIONAL_AUTHORIZATION",
            "NEXT_STAGE_AUTHORIZED",
            "CAPTURE_EXECUTED",
            "MATERIALIZATION_EXECUTED",
            "PROD_ACCESSED",
            "SINGLE_USE_SCOPE",
            "ROLLBACK_CONFIRMED",
            "CONNECTION_CLOSED",
            "PREFLIGHT_FAILURE_PHASE",
            "RESULT"
          ],
          "properties": {
            "ENVIRONMENT": {"const": "DEV"},
            "OPERATIONAL_AUTHORIZATION": {"const": false},
            "NEXT_STAGE_AUTHORIZED": {"const": false},
            "CAPTURE_EXECUTED": {"const": false},
            "MATERIALIZATION_EXECUTED": {"const": false},
            "PROD_ACCESSED": {"const": false},
            "SINGLE_USE_SCOPE": {"const": "PROCESS_INVOCATION_ONLY"},
            "ROLLBACK_CONFIRMED": {"const": false},
            "CONNECTION_CLOSED": {"const": true},
            "PREFLIGHT_FAILURE_PHASE": {"const": "CONNECT_TLS_AUTH"},
            "RESULT": {"const": "BLOCKED_DATABASE_PREFLIGHT_FAILED"}
          }
        }
      }
    },
    "interpretation_boundary": {
      "type": "object",
      "additionalProperties": false,
      "required": [
        "root_cause",
        "establishes_only",
        "does_not_establish",
        "rollback_false_means",
        "connection_closed_true_means"
      ],
      "properties": {
        "root_cause": {"const": "UNDETERMINED"},
        "establishes_only": {
          "type": "array",
          "minItems": 1,
          "maxItems": 1,
          "uniqueItems": true,
          "items": {"const": "CONNECT_TLS_AUTH_FRONTIER_INITIATED_AND_INVOCATION_BLOCKED"}
        },
        "does_not_establish": {
          "type": "array",
          "minItems": 11,
          "maxItems": 11,
          "uniqueItems": true,
          "items": {
            "enum": [
              "DNS_SUCCESS_OR_FAILURE",
              "TCP_SUCCESS_OR_FAILURE",
              "TLS_SUCCESS_OR_FAILURE",
              "CA_VALIDITY_OR_INVALIDITY",
              "ENDPOINT_AVAILABILITY",
              "CONNECTION_ESTABLISHED",
              "CREDENTIAL_VALIDITY_OR_INVALIDITY",
              "AUTHENTICATION_ATTEMPTED",
              "DATABASE_SESSION_ESTABLISHED",
              "TRANSACTION_STARTED",
              "PROJECT_IDENTITY"
            ]
          }
        },
        "rollback_false_means": {
          "const": "ROLLBACK_NOT_CONFIRMED_AND_TRANSACTION_MAY_NEVER_HAVE_STARTED"
        },
        "connection_closed_true_means": {
          "const": "COMPATIBLE_WITH_NO_CONNECTION_OPENED_OR_WITH_LATER_CLOSE"
        }
      }
    },
    "future_probe_contract": {
      "type": "object",
      "additionalProperties": false,
      "required": [
        "implementation_present",
        "network_capability_present",
        "execution_disabled",
        "separate_implementation_required",
        "separate_nominal_execution_authorization_required",
        "target_contract",
        "phase_allowlist",
        "wire_contract",
        "dns_and_address_policy",
        "tls_policy",
        "input_policy",
        "output_policy",
        "forbidden_actions"
      ],
      "properties": {
        "implementation_present": {"const": false},
        "network_capability_present": {"const": false},
        "execution_disabled": {"const": true},
        "separate_implementation_required": {"const": true},
        "separate_nominal_execution_authorization_required": {"const": true},
        "target_contract": {
          "type": "object",
          "additionalProperties": false,
          "required": [
            "environment",
            "endpoint_kind",
            "port",
            "raw_hostname_persisted",
            "raw_project_ref_persisted",
            "target_identity_claimed"
          ],
          "properties": {
            "environment": {"const": "DEV"},
            "endpoint_kind": {"const": "DIRECT_POSTGRES_TRANSPORT_ONLY"},
            "port": {"const": 5432},
            "raw_hostname_persisted": {"const": false},
            "raw_project_ref_persisted": {"const": false},
            "target_identity_claimed": {"const": false}
          }
        },
        "phase_allowlist": {
          "type": "array",
          "minItems": 8,
          "maxItems": 8,
          "uniqueItems": true,
          "prefixItems": [
            {"const": "PRECONNECT_GUARDS"},
            {"const": "DNS_RESOLUTION"},
            {"const": "ADDRESS_POLICY"},
            {"const": "TCP_CONNECT"},
            {"const": "PG_SSL_NEGOTIATION"},
            {"const": "TLS_HANDSHAKE"},
            {"const": "TLS_HOSTNAME_VERIFICATION"},
            {"const": "SOCKET_CLOSE"}
          ],
          "items": false
        },
        "wire_contract": {
          "type": "object",
          "additionalProperties": false,
          "required": [
            "postgres_sslrequest_hex",
            "required_server_response",
            "startup_message_allowed",
            "authentication_allowed",
            "database_session_allowed",
            "sql_allowed"
          ],
          "properties": {
            "postgres_sslrequest_hex": {"const": "0000000804d2162f"},
            "required_server_response": {"const": "S"},
            "startup_message_allowed": {"const": false},
            "authentication_allowed": {"const": false},
            "database_session_allowed": {"const": false},
            "sql_allowed": {"const": false}
          }
        },
        "dns_and_address_policy": {
          "type": "object",
          "additionalProperties": false,
          "required": [
            "resolve_count_max",
            "all_resolved_addresses_must_be_global",
            "connect_uses_numeric_address",
            "original_hostname_used_only_for_sni_and_hostname_check",
            "deterministic_single_address_selection",
            "retry_allowed",
            "fallback_allowed",
            "overall_deadline_required",
            "deadline_value_requires_future_authorization"
          ],
          "properties": {
            "resolve_count_max": {"const": 1},
            "all_resolved_addresses_must_be_global": {"const": true},
            "connect_uses_numeric_address": {"const": true},
            "original_hostname_used_only_for_sni_and_hostname_check": {"const": true},
            "deterministic_single_address_selection": {"const": true},
            "retry_allowed": {"const": false},
            "fallback_allowed": {"const": false},
            "overall_deadline_required": {"const": true},
            "deadline_value_requires_future_authorization": {"const": true}
          }
        },
        "tls_policy": {
          "type": "object",
          "additionalProperties": false,
          "required": [
            "mode",
            "explicit_ca_required",
            "system_ca_fallback_allowed",
            "certificate_required",
            "hostname_check_required",
            "ca_sha256_authorization_binding_required"
          ],
          "properties": {
            "mode": {"const": "VERIFY_FULL_EXPLICIT_CA"},
            "explicit_ca_required": {"const": true},
            "system_ca_fallback_allowed": {"const": false},
            "certificate_required": {"const": true},
            "hostname_check_required": {"const": true},
            "ca_sha256_authorization_binding_required": {"const": true}
          }
        },
        "input_policy": {
          "type": "object",
          "additionalProperties": false,
          "required": [
            "private_descriptor_only",
            "argv_secrets_allowed",
            "environment_variable_secrets_allowed",
            "password_allowed",
            "database_user_allowed",
            "database_name_allowed",
            "dsn_allowed",
            "authorization_binding_required"
          ],
          "properties": {
            "private_descriptor_only": {"const": true},
            "argv_secrets_allowed": {"const": false},
            "environment_variable_secrets_allowed": {"const": false},
            "password_allowed": {"const": false},
            "database_user_allowed": {"const": false},
            "database_name_allowed": {"const": false},
            "dsn_allowed": {"const": false},
            "authorization_binding_required": {"const": true}
          }
        },
        "output_policy": {
          "type": "object",
          "additionalProperties": false,
          "required": [
            "sanitized_only",
            "raw_hostname_allowed",
            "ip_address_allowed",
            "certificate_metadata_allowed",
            "exception_text_allowed",
            "logs_accessed",
            "local_persistence_allowed",
            "external_telemetry_may_exist_if_future_execution_is_authorized"
          ],
          "properties": {
            "sanitized_only": {"const": true},
            "raw_hostname_allowed": {"const": false},
            "ip_address_allowed": {"const": false},
            "certificate_metadata_allowed": {"const": false},
            "exception_text_allowed": {"const": false},
            "logs_accessed": {"const": false},
            "local_persistence_allowed": {"const": false},
            "external_telemetry_may_exist_if_future_execution_is_authorized": {"const": true}
          }
        },
        "forbidden_actions": {
          "type": "array",
          "minItems": 10,
          "maxItems": 10,
          "uniqueItems": true,
          "items": {
            "enum": [
              "PASSWORD_USE",
              "POSTGRES_STARTUP_MESSAGE",
              "AUTHENTICATION",
              "DATABASE_SESSION",
              "SQL",
              "LOG_ACCESS",
              "PROD_ACCESS",
              "CAPTURE",
              "MATERIALIZATION",
              "RETRY_OR_FALLBACK"
            ]
          }
        }
      }
    },
    "mission_evidence": {
      "type": "object",
      "additionalProperties": false,
      "required": [
        "network_accessed",
        "dns_queried",
        "tcp_attempted",
        "tls_attempted",
        "password_accessed",
        "sql_executed",
        "database_session_established",
        "logs_accessed",
        "dev_accessed",
        "prod_accessed",
        "capture_executed",
        "materialization_executed"
      ],
      "properties": {
        "network_accessed": {"const": false},
        "dns_queried": {"const": false},
        "tcp_attempted": {"const": false},
        "tls_attempted": {"const": false},
        "password_accessed": {"const": false},
        "sql_executed": {"const": false},
        "database_session_established": {"const": false},
        "logs_accessed": {"const": false},
        "dev_accessed": {"const": false},
        "prod_accessed": {"const": false},
        "capture_executed": {"const": false},
        "materialization_executed": {"const": false}
      }
    },
    "next_gate": {
      "const": "REVIEW_AND_CI_DEV_CONNECT_TLS_AUTH_OFFLINE_DIAGNOSTICS_PR"
    }
  }
}
